{
  "id": "3938d867-d3ca-495a-8c84-321363c70cdc",
  "sessionId": "3938d867-d3ca-495a-8c84-321363c70cdc",
  "command": "dev-docs-update",
  "state": {},
  "workspaceSnapshot": {
    "root": "/Users/felipe/Developer/skills-fabrik",
    "gitStatus": {
      "branch": "main",
      "commit": "abc123",
      "clean": false,
      "modified": [
        "src/file1.ts",
        "src/file2.ts"
      ],
      "staged": [
        "src/file3.ts"
      ],
      "untracked": [
        "new-file.ts"
      ]
    },
    "packageJson": {
      "name": "skills-fabrik",
      "version": "0.1.0",
      "description": "Skills Fabric - Sistema de gestión de Skills con CLOOP methodology",
      "private": true,
      "scripts": {
        "build": "pnpm --filter @skills-fabrik/slash-commands build && pnpm --filter @skills-fabrik/skills-cli build && pnpm --filter @skills-fabrik/daemon build",
        "bench:activate": "node scripts/bench-activate.mjs",
        "test:parity": "node --test packages/skills-cli/test/parity.activate.spec.mjs",
        "dev": "pnpm --filter @skills-fabrik/skills-cli dev",
        "test": "pnpm --filter @skills-fabrik/skills-cli test",
        "test:integration": "bash packages/skills-cli/test/integration/run-tests.sh",
        "test:skills": "bash packages/skills-cli/test/integration/run-tests.sh skills",
        "test:plan": "bash packages/skills-cli/test/integration/run-tests.sh plan",
        "test:kpi": "bash packages/skills-cli/test/integration/run-tests.sh kpi",
        "test:visual": "bash packages/skills-cli/test/integration/run-tests.sh visual",
        "test:workflows": "bash packages/skills-cli/test/integration/run-tests.sh workflows",
        "test:skill-rules-schema": "node --test packages/skills-cli/test/skill-rules.schema.spec.mjs",
        "test:activation-cases": "jest --config packages/router/jest.config.js --runTestsByPath packages/router/src/__tests__/activation-cases.spec.ts || node --test packages/router/src/__tests__/activation-cases.spec.ts",
        "kpi:rollup": "node scripts/kpi/rollup.mjs",
        "lint": "prettier --check . && eslint .",
        "lint:fix": "prettier --write . && eslint --fix .",
        "format": "prettier --write .",
        "gates": "bash scripts/devops/gates-runner.sh",
        "prepare": "husky install",
        "pr": "bash scripts/devops/create-pr.sh",
        "gh-setup": "bash scripts/devops/gh-setup.sh",
        "skills:index": "node packages/skills-cli/dist/index.js skills index ./skills --out ./registry/index.json",
        "skills:lint": "node packages/skills-cli/dist/index.js skills lint ./skills --strict",
        "skills:rules": "node packages/skills-cli/dist/index.js skills rules",
        "kpi:gen": "node packages/skills-cli/dist/index.js kpi --days 7 --output docs/kpi/DASHBOARD.md",
        "kpi:show": "node packages/skills-cli/dist/index.js kpi --days 7",
        "router:build": "pnpm --filter @skills-fabrik/router run build",
        "e2e": "pnpm router:build && node --loader ts-node/esm packages/router/e2e/simulate.ts || (echo '⚠️  ts-node not found. Install: pnpm add -D ts-node typescript' && exit 1)",
        "test:phase3": "bash scripts/tests/run-phase3-tests.sh",
        "test:phase3-quick": "pnpm -w build && pnpm skills:lint --strict && node -e \"require('./configs/skill-rules.json'); console.log('✅ Schema válido')\"",
        "test:chaos:auto-recovery": "node scripts/tests/run-chaos-auto-recovery-test.cjs",
        "test:chaos:enhanced": "cd packages/skills-cli && node test/chaos/enhanced-chaos-test.cjs",
        "test:security:optimize": "node scripts/tests/test-simple-security-optimization.cjs",
        "test:boundary:enhanced": "node scripts/tests/test-enhanced-boundary-testing-simple.cjs",
        "test:e2e:scale": "node scripts/tests/test-e2e-scale-simple.cjs",
        "test:chaos:dashboard": "node scripts/tests/test-chaos-dashboard.cjs",
        "test:performance:optimized": "node scripts/tests/test-performance-optimized-suite.cjs",
        "monitoring:dashboard": "node scripts/monitoring/enterprise-monitoring-dashboard.cjs",
        "production:readiness": "node scripts/automation/production-readiness-automation.cjs",
        "docs:generate": "node scripts/documentation/enterprise-documentation-generator-fixed.cjs",
        "triada:update": "node scripts/update-triada.mjs",
        "smoke:pg": "node scripts/smoke-pg.mjs",
        "snapshot:activate": "node scripts/snapshot-activate.mjs",
        "test:snapshot": "node --test packages/daemon/test/snapshot.activate.spec.mjs",
        "test:schema": "node --test packages/daemon/test/schema.activate.spec.mjs",
        "test:policy:deny": "node --test packages/daemon/test/policy.deny.spec.mjs",
        "test:policy:allow": "node --test packages/daemon/test/policy.allow.spec.mjs",
        "snapshot:execute": "node scripts/snapshot-execute.mjs",
        "test:snapshot:execute": "node --test packages/daemon/test/snapshot.execute.spec.mjs",
        "f2:close": "node scripts/close-f2.mjs",
        "f3:close": "node scripts/close-f3.mjs",
        "test:pack": "node --test packages/skills-cli/test/pack.spec.mjs",
        "test:pack:det": "node --test packages/skills-cli/test/pack.determinism.spec.mjs",
        "test:verify": "node --test packages/skills-cli/test/verify.spec.mjs",
        "test:install": "node --test packages/skills-cli/test/install.spec.mjs",
        "test:manifest:schema": "node --test packages/skills-cli/test/manifest.schema.spec.mjs",
        "test:confirm:inline": "node --test packages/skills-cli/test/confirm.inline.spec.mjs",
        "test:metrics": "node --test packages/daemon/test/metrics.spec.mjs",
        "test:policy:s1": "node --test packages/daemon/test/policy.s1.spec.mjs",
        "test:policy:s2": "node --test packages/daemon/test/policy.s2.spec.mjs",
        "test:policy:net": "node --test packages/daemon/test/policy.net.spec.mjs",
        "test:policy:levels": "node --test packages/daemon/test/policy.levels.spec.mjs",
        "test:confirm:s1:challenge": "node --test packages/daemon/test/confirm.s1.challenge.spec.mjs",
        "test:confirm:s1:badtoken": "node --test packages/daemon/test/confirm.s1.badtoken.spec.mjs",
        "test:confirm:s1:ok": "node --test packages/daemon/test/confirm.s1.ok.spec.mjs",
        "pack:sample": "node packages/skills-cli/dist/index.js skills pack skills/repo-auditor --out ./.registry",
        "verify:sample": "pnpm run pack:sample && node packages/skills-cli/dist/index.js skills verify ./.registry/repo-auditor-0.1.0.tgz",
        "install:sample": "pnpm run verify:sample && node packages/skills-cli/dist/index.js skills install file://./.registry/repo-auditor-0.1.0.tgz --target ./.skills-installed --force",
        "f4:check": "pnpm test:pack && pnpm test:verify && pnpm test:install && pnpm test:pack:det && pnpm test:manifest:schema",
        "f4:close": "node scripts/close-f4.mjs",
        "f5:close": "node scripts/close-f5.mjs",
        "smoke:metrics": "node scripts/smoke-metrics.mjs",
        "clean": "node scripts/clean-dist.mjs",
        "build:all": "pnpm clean && pnpm -w build",
        "pretest": "node scripts/guard-stale-dist.mjs",
        "pretest:metrics": "node scripts/guard-stale-dist.mjs",
        "pretest:confirm:s1:challenge": "node scripts/guard-stale-dist.mjs",
        "pretest:confirm:s1:badtoken": "node scripts/guard-stale-dist.mjs",
        "pretest:confirm:s1:ok": "node scripts/guard-stale-dist.mjs",
        "pretest:confirm:inline": "node scripts/guard-stale-dist.mjs",
        "pretest:pack": "node scripts/guard-stale-dist.mjs",
        "pretest:verify": "node scripts/guard-stale-dist.mjs",
        "pretest:install": "node scripts/guard-stale-dist.mjs",
        "pretest:pack:det": "node scripts/guard-stale-dist.mjs",
        "pretest:manifest:schema": "node scripts/guard-stale-dist.mjs",
        "f6:close": "node scripts/close-f6.mjs"
      },
      "devDependencies": {
        "@commitlint/cli": "^18.4.4",
        "@commitlint/config-conventional": "^18.4.4",
        "@jest/globals": "^29.7.0",
        "@types/jest": "^29.5.14",
        "@typescript-eslint/eslint-plugin": "^6.15.0",
        "@typescript-eslint/parser": "^6.15.0",
        "ajv": "^8.17.1",
        "dotenv": "^17.2.3",
        "eslint": "^8.56.0",
        "husky": "^8.0.3",
        "jest": "^29.7.0",
        "jest-junit": "^16.0.0",
        "lint-staged": "^15.2.0",
        "pm2": "^6.0.13",
        "prettier": "^3.1.1",
        "ts-jest": "^29.4.5",
        "typescript": "^5.3.3"
      },
      "engines": {
        "node": ">=18.0.0",
        "pnpm": ">=8.0.0"
      },
      "packageManager": "pnpm@8.10.0",
      "bin": {
        "sf": "packages/skills-cli/dist/index.js"
      },
      "dependencies": {
        "@fastify/cors": "^8.4.0",
        "@types/pg": "^8.15.6",
        "pg": "^8.16.3"
      }
    },
    "env": {
      "NODE_ENV": "development",
      "LOG_LEVEL": "info",
      "SF_STORAGE_L0": ".sf",
      "SF_STORAGE_L1": ".sf/cache"
    }
  },
  "memtechL1Key": "slash:context:3938d867-d3ca-495a-8c84-321363c70cdc",
  "createdAt": "2025-11-01T12:52:19.443Z",
  "updatedAt": "2025-11-01T12:52:19.443Z",
  "expiresAt": "2025-11-02T12:52:19.443Z"
}